网点名称,网点地址,电话,Longitude,Latitude
交通银行宁波鄞州中心区支行,宁波鄞州区建兴路50-54号,0574-88101732,121.55946,29.84273
交通银行宁波分行营业部,鄞州区海晏北路455号,0574-87363721,121.615807,29.865039
交通银行宁波高新区支行,宁波市江南路628号,0574-87720016,121.61708,29.8880
交通银行宁波鄞州支行,鄞州贸城中路9-19号,0574-83089870,121.56731,29.82265
交通银行宁波象山支行,象山县天安路162号,0574-65655962,121.87723,29.46904
交通银行宁波宁海支行,宁海县跃龙街道学勉路1号（金融中心）,0574-65266116%E3%80%8165266125,121.443172,29.309341
交通银行宁波余姚支行,余姚市南雷路31号,0574-62703326%E3%80%8162703325,121.15743,30.04541
交通银行宁波联盟桥支行,余姚市城区子陵路55-1号,0574-62637857,121.157656,30.060217
交通银行宁波城西支行,余姚市阳明西路347号,0574-62821102,121.13739,30.04783
交通银行宁波余姚金融大厦支行,余姚市南雷南路1号,0574-62637812,121.158731,30.03373
交通银行宁波余姚泗门支行,余姚市泗门镇光明南路278号,0574-62681580,121.04172,30.15568
交通银行宁波余姚塑料城支行,余姚市舜达西路287号,0574-62532408,121.16186,30.08409
交通银行宁波新城支行,慈溪市新城大道北路531号,0574-63036733,121.26697,30.17837
交通银行宁波慈溪支行,慈溪市孙塘南路265号,0574-58589139,121.25651,30.16754
交通银行宁波朱家桥支行,慈溪市环城南路350号,0574-63811911,121.24062,30.16726
交通银行宁波周巷支行,慈溪市周巷镇兴业北路441-455号,0574-63330605,121.13403,30.17823
交通银行宁波观城支行,观海卫镇南央路2号,0574-63635550,121.40432,30.16607
交通银行宁波杭州湾新区支行,宁波杭州湾新区滨海二路879、881号,0574-63937682,121.226447,30.322804
交通银行宁波奉化溪口支行,奉化市溪口镇中兴中路149号,0574-88929222,121.42014,29.65544
交通银行宁波奉化支行,奉化市南山路81号,0574-88529857,121.41157,29.66186
交通银行宁波奉化岳林支行,奉化市岳林街道惠政东路1、3号,0574-%E6%97%A0%E5%AF%B9%E5%85%AC%E4%B8%9A%E5%8A%A1,121.419708,29.655249
交通银行温州分行营业部,鹿城区车站大道160号交行广场一楼,0577-88068576,120.68549,27.990996
交通银行温州小南路支行,鹿城区小南路巴黎大厦一、二楼,0577-88257437,120.658077,28.007436
交通银行温州开发区支行,温州新城大道华泰大厦一楼交行,0577-88924878,120.705601,27.998158
交通银行温州城西支行,鹿城工业区利生路6号,0577-88766623,120.618874,28.018845
交通银行温州中山支行,鹿城区飞霞大厦一楼（停止营业）,0577-88815300,120.668973,28.007351
交通银行温州鹿城支行,鹿城区杏花路193号,0577-88519482,120.647011,28.006164
交通银行温州水心支行,鹿城区马鞍池西路康乐大厦主楼一楼,0577-88524996,120.651596,28.001772
交通银行温州黎明支行,温州市飞霞北路341号,0577-88199925,120.666552,28.020858
交通银行温州滨江支行,温州市鹿城区聚英家园1幢103、104室,0577-88857125,120.725221,28.005033
交通银行温州高新区支行,雁荡西路269号,0577-88817765,120.714047,27.987533
交通银行温州信河支行,信河街305号,0577-88257472,120.652866,28.012487
交通银行温州南浦支行,鹿城区下吕浦王子花苑11幢一楼,0577-88395775,120.677588,27.987405
交通银行温州商贸城支行,鹿城区黄龙商贸城家电市场2区2号,0577-88731066,120.626776,28.007607
交通银行温州龙湾支行,龙湾区永中街道永强大道4488号东方明珠城北首一、二层,0577-86881517,120.829919,27.910972
交通银行温州瓯海支行,温州瓯海区兴海路1号,0577-88500905,120.639933,28.006662
交通银行温州新桥支行,浙江省温州市瓯海区新桥金蟾大道121号中天公寓C幢101-105室,0577-88438802,120.622777,27.983904
交通银行温州永嘉支行,永嘉县瓯北镇双塔路龙桥大厦,0577-66991690,120.650556,28.040357
交通银行温州苍南支行,苍南县龙港镇康鑫大厦一楼,0577-68677007,120.537973,27.579218
交通银行温州瑞安塘下支行,瑞安市塘下镇明珠大厦一楼,0577-66009028,120.698074,27.826562
交通银行温州瑞安支行,瑞安市莘塍街道万松东路星海广场2号楼一、二层,0577-65910700,120.669212,27.777848
交通银行温州乐清支行,乐清市旭阳路时代御峰花园,0577-61601082,120.9879346683,28.1097289220
交通银行温州乐清柳市支行,乐清市柳市镇柳青南路1508号,0577-61781016,120.894235,28.040755
交通银行嘉兴开发区支行,越秀北路293号,0573-82113597,120.73349,30.76448
交通银行嘉兴禾兴支行,城北路255号,0573-82222328.82219958,120.74456,30.77033
交通银行嘉兴分行营业部,中山东路1086号,0573-82052151,120.73779,30.75994
交通银行嘉兴禾城支行,建国南路271号,0573-82058120,120.75421,30.76291
交通银行嘉兴南湖支行,中环南路与富润路交叉口,0573-82570395,120.77509,30.73787
交通银行嘉兴秀洲支行,中山西路与秀园路交叉口,0573-82793971,120.68690,30.75612
交通银行嘉兴嘉善支行,嘉善县罗星街道嘉善大道107号,0573-84213810,120.92758,30.83115
交通银行嘉兴海盐支行,海盐县新桥南路66号,0573-86186809,120.947467,30.5121
交通银行嘉兴海宁支行,海宁市海昌南路28号,0573-87296019,120.68971,30.51725
交通银行嘉兴海宁长安支行,浙江省嘉兴海宁市长安镇长安路138号,0573-80709155,120.453862,30.441492
交通银行嘉兴平湖支行,平湖市新华南路325号,0573-85288212,121.01116,30.68626
交通银行嘉兴桐乡支行,桐乡市振兴东路366号,0573-88138013,120.57011,30.62911
交通银行湖州仁皇山支行,浙江省湖州市吴兴区仁皇山街道龙王山路1113-1115号,0572-2198565,120.08580,30.88700
交通银行湖州吴兴支行,浙江省湖州市米兰商业街3－5号,0572-2066917,120.124211,30.881307
交通银行湖州开发区支行,浙江省湖州市龙溪北路219号,0572-2118532,120.089638,30.87261
交通银行湖州凤凰支行,浙江省湖州市凤凰路333号,0572-2116281,120.095158,30.879613
交通银行湖州织里支行,浙江省湖州市织里镇棉布城一幢9-11号,0572-3179375,120.25840,30.87042
交通银行湖州市中支行,浙江省湖州市红旗路172号,0572-2212804,120.09556,30.864671
交通银行湖州分行营业部,浙江省湖州市人民路299号,0572-2211748%2F2057483,120.103097,30.871726
交通银行湖州东街支行,湖州市吴兴区威莱大街88号,0572-2115655,120.104731,30.862568
交通银行湖州南浔支行,浙江省湖州市南浔镇泰安路375号,0572-3031275,120.422636,30.876697
交通银行湖州德清支行,浙江省湖州市德清县英溪南路125-133号,0572-8062358,119.964872,30.535133
交通银行湖州长兴长海路支行,浙江省湖州市长兴县雉城镇长海路350-352号,0572-6321751,119.907300,30.997300
交通银行湖州长兴支行,浙江省湖州市长兴县雉城镇解放西路9号,0572-6056507,119.905965,31.003385
交通银行绍兴白鹭支行,浙江省绍兴市越城区后墅南路73-71号,0575-85129906,120.589435,30.021766
交通银行绍兴分行营业部,绍兴市人民中路283号,0575-85202817%E6%B1%87%E7%A5%A8%E6%9F%A5%E8%AF%A2%3A0575-85202929,120.58692,29.99682
交通银行绍兴迪荡支行,绍兴市越城区胜利东路377号,0575-85146270,120.60100,30.00431
交通银行绍兴越城支行,解放北路163号,0575-85138690,120.58163,30.00700
交通银行绍兴延安路支行,绍兴市中兴南路318号,0575-88322213,120.58657,29.99002
交通银行绍兴文锦支行,绍兴市环城西路496号,0575-85138437,120.57516,29.99176
交通银行绍兴城东支行,绍兴市延安东路161号,0575-88654142,120.60263,29.98927
交通银行绍兴袍江支行,袍江工业区世纪街财税大楼一楼,0575-88131062,120.60689,30.07850
交通银行绍兴城南支行,解放南路1541号,0575-88333671,120.57899,29.96972
交通银行绍兴中国轻纺城支行,绍兴市柯桥区金柯桥大道232号,0575-84129902,120.48955,30.06845
交通银行绍兴中国轻纺城东区支行,绍兴市柯桥区中国轻纺城东交易区二楼131、132、166、167号,0575-84078070,120.48633,30.06054
交通银行绍兴中国轻纺城钱清支行,绍兴市柯桥区钱清镇中国轻纺原料城A1幢6、8-13、15、17、19号；,0575-84516019,120.41051,30.12965
交通银行绍兴中国轻纺城北区支行,绍兴市柯桥区中国轻纺城北四区大厅,0575-84112116,120.48869,30.06417
交通银行绍兴中国轻纺城东升路支行,绍兴市柯桥区中国轻纺城东升路市场A区1楼015-017-018号,0575-84093990,120.48136,30.06399
交通银行绍兴新昌支行,新昌县城关镇人民中路152-154号,0575-86025812,120.90678,29.49850
交通银行绍兴新昌大通支行,绍兴新昌鼓山西路657-663号,0575-86240835,120.86398,29.50180
交通银行绍兴新昌通明支行,新昌县鼓山中路224-3、4号,0575-86337138,120.89089,29.503951
交通银行绍兴诸暨支行,诸暨市艮塔东路1号,0575-87376922,120.24646,29.71675
交通银行绍兴诸暨城东支行,诸暨市环城东路207号,0575-87261207,120.25548,29.71203
交通银行绍兴诸暨店口支行,诸暨市店口镇中央大道海亮商务酒店东侧,0575-87399669,120.32361,29.92274
交通银行绍兴诸暨大唐支行,诸暨市大唐镇雍平路宏磊公寓商铺17-20号,0575-87029992,120.15178,29.69120
交通银行绍兴上虞支行,上虞区百官街道青春路5号,0575-82028850,120.87980,30.01783
交通银行绍兴上虞曹娥支行,上虞区曹娥街道人民中路562号,0575-82216424,120.86336,30.01281
交通银行绍兴上虞上街支行,浙江省上虞区百官街道龙山路16号,0575-82215293,120.87744,30.011607
交通银行绍兴上虞新街支行,上虞区百官街道凤鸣路366号,0575-82211404,120.87895,30.03643
交通银行绍兴嵊州支行,嵊州市嵊州大道338号,0575-0575%EF%BC%8D83035987,120.83026,29.59678
交通银行绍兴嵊州广通支行,嵊州市一景路22-28号,0575-83342122,120.83604,29.58526
交通银行绍兴嵊州越州支行,嵊州市北直街1号,0575-83028263,120.82226,29.58620
交通银行金华分行营业部,金华市婺城区双溪西路191号,0579-82139901,119.64817,29.08966
交通银行金华婺州支行,金华市双龙南街1246号,0579-82556827,119.646953,29.070695
交通银行金华武义支行,浙江省金华武义县武阳西路88号,0579-87888806,119.809803,28.894742
交通银行金华浦江支行,浙江省浦江县浦阳镇人民东路53号,0579-84333983,119.89521,29.45133
交通银行义乌江南支行,浙江省义乌市南门街477号,0579-0579-85815028,120.079333,29.288514
交通银行义乌分行营业部,义乌市福田街道福银大厦1号楼（福田银座A座）,0579-0579-85573685,120.10889694040299,29.328000994906677
交通银行义乌篁园支行,篁园路５１号,0579-85036855,120.08032,29.30041
交通银行金华东阳支行,东阳市江滨南路101号,0579-86266026,120.24404,29.28534
交通银行金华永康支行,永康市五金北路279号,0579-87087989,120.05180,28.89210
交通银行衢州龙化路支行,浙江省衢州市柯城区龙化路195-197号,0570-8519288,118.896406,28.947278
交通银行衢州分行营业部,浙江省衢州市新桥街17号,0570-8519083,118.874066,28.958958
交通银行衢州江山支行,江山市中山路25号,0570-4905022,118.63176,28.736633
交通银行舟山分行营业部,定海区环城北路177号,0580-2260737,122.108789,30.0261
交通银行浙江自贸区支行,舟山市普陀区东港街道海洲路727号,0580-3811912,122.328461,29.973802
交通银行台州分行营业部,椒江中心大道127-129号（葭芷大转盘南）,0576-89021105,121.41145,28.670912
交通银行台州黄岩支行,黄岩区城关塔院头路43号,0576-89190719%2F89190718,121.26014,28.647815
交通银行台州路桥支行,路桥区东路桥大道8号,0576-89218028%2F89218026,121.372533,28.584051
交通银行台州玉环支行,玉环市玉城街道泰安路310号财富中心3号楼,0576-87471032,121.23684,28.119965
交通银行台州温岭支行,温岭市太平街道中华北路557号,0576-82834007,121.369247,28.38288
交通银行台州临海支行,临海市古城街道巾山东路192号,0576-89361715%2F89361716,121.13357815235167,28.84775425867774
交通银行丽水分行营业部,丽水市莲都区中东路693号,0578-2082076,119.932913,28.450002
交通银行合肥合裕路支行,合肥市裕溪路（原合裕路）1545号,0551-64424054,117.313771,31.852359
交通银行合肥新站支行,铜陵北路与扶疏路交叉口,0551-64253325,117.326946,31.895978
交通银行合肥寿春支行,合肥市长江东路1049号,0551-64293881,117.306991,31.865066
交通银行合肥馥邦广场支行,安徽省合肥市新站区铜陵北路与物流大道交口馥邦商务广场商业楼1.2.3幢101号,0551-62632065,117.3292,31.9018
交通银行合肥长江东路支行,合肥市长江东路676号,0551-64214537,117.32238,31.86807
交通银行合肥阜阳路桥支行,合肥市阜阳路159号,0551-65543416,117.28722,31.87696
交通银行合肥三孝口支行,合肥市金寨路389号,0551-62848270,117.275732,31.858355
交通银行合肥三牌楼支行,合肥市长江中路57号,0551-62609312,117.292914,31.861913
交通银行安徽省分行营业部,合肥市花园街38号,0551-62637036,117.285844,31.865194
交通银行合肥新天地广场支行,合肥市濉溪路168号新天地广场,0551-65628341,117.27901,31.880327
交通银行合肥阜阳北路支行,合肥市阜阳北路666号,0551-65608053%E3%80%8165616085,117.286085,31.895103
交通银行合肥屯溪路支行,合肥市南一环与肥西路交叉口汇金大厦1-2层,0551-65176191,117.259859,31.851151
交通银行合肥科学大道支行,合肥市科学大道8号（科学大道与银杏路交口）,0551-65845293,117.201236,31.820384
交通银行合肥高新区支行,合肥市希望路1号,0551-65315092,117.204911,31.855749
交通银行合肥三里庵支行,合肥市长江西路200号怡秀山庄1栋,0551-65141592,117.258185,31.855685
交通银行合肥繁华支行,合肥市繁华大道256号,0551-63674002,117.22953,31.77674
交通银行合肥长江西路支行,合肥市蜀山区长江西路与潜山路交口恒兴大厦一层,0551-65129016,117.232157,31.851661
交通银行合肥南七支行,合肥市金寨南路1148号,0551-63637994,117.264547,31.829012
交通银行合肥祁门路支行,合肥市翡翠路1118号出版集团大厦一楼,0551-63533129,117.216815,31.808568
交通银行合肥琥珀山庄支行,安徽省合肥市蜀山区琥珀山庄小区44幢,0551-62813531,117.26385,31.86645
交通银行合肥创新大道支行,安徽省合肥市蜀山区创新大道2800号创新产业园二期E2楼C座1层,0551-62845002,117.137005,31.837925
交通银行合肥马鞍山路支行,马鞍山路与望江东路交口东200米金中环广场,0551-62921297,117.304898,31.828119
交通银行合肥宁国路支行,合肥市宁国路钻石大厦一楼,0551-62864759,117.290602,31.852609
交通银行合肥黄山路支行,合肥市黄山路与金寨路交叉口,0551-63653284,117.269574,31.842156
交通银行合肥东陈岗支行,合肥市徽州大道707号,0551-64660114,117.284932,31.837325
交通银行合肥望江东路支行,安徽省合肥市包河区望江东路60号,0551-63438907,117.280812,31.82893
交通银行合肥马鞍山南路支行,合肥市马鞍山路509号++2019年+2月3日17：00-2月11日8：30停止对外服务。。,0551-63415467,117.301068,31.833141
交通银行合肥北京路支行,合肥市北京路8号皖新传媒大厦一楼,0551-62679937,117.3248,31.793008
交通银行合肥宁国南路支行,合肥市宁国南路与青年路交口益力檀宫一楼,0551-63612417,117.293311,31.824782
交通银行合肥滨湖新区支行,合肥市紫云路世纪城商业楼一层,0551-62991407,117.287979,31.741672
交通银行合肥肥西支行,合肥市肥西县金寨南路与青年北路交口华邦万派城一楼,0551-68881077,117.163911,31.727054
交通银行巢湖分行,巢湖市健康西路丽景国际综合楼一楼,0551-82390055,117.862594,31.60671
交通银行芜湖分行营业部,芜湖市镜湖区北京西路交行大楼（市鸠兹广场处）,0553-3839550,118.37231,31.33163
交通银行芜湖方特支行,芜湖市镜湖区银湖北路21号宝文国际广场,0553-5871370,118.372487,31.379452
交通银行芜湖新芜路支行,芜湖市镜湖区新芜路广玉兰花园6号,0553-3853589,118.362837,31.32754
交通银行芜湖银湖路支行,芜湖市镜湖区银湖中路35-2号,0553-5011484,118.374309,31.353393
交通银行芜湖芜宁路支行,芜湖市镜湖区芜宁路79号,0553-3844140,118.381419,31.351988
交通银行芜湖康复路支行,芜湖市镜湖区黄山园2号楼,0553-3874481,118.388147,31.323479
交通银行芜湖长江路支行,芜湖市镜湖区长江中路43号-9,0553-5855684,118.364328,31.353096
交通银行芜湖利民路支行,芜湖市弋江区新时代商业街A1-9号门面房,0553-4226259,118.378276,31.314342
交通银行芜湖高新技术开发区支行,芜湖市弋江区花津南路中央城财富街1号楼03-05室,0553-3027575,118.373373,31.296191
交通银行芜湖南瑞支行,芜湖市弋江区南瑞新城商业街3幢1#,0553-3840512,118.39312,31.30685
交通银行芜湖经济技术开发区支行,芜湖市鸠江区港湾路17号中交二航四公司办公楼一层门面房,0553-5842594,118.366334,31.413355
交通银行芜湖天门山支行,芜湖市鸠江区大桥镇大桥新城8号楼1001-1008门面房,0553-5317103,118.409443,31.466593
交通银行芜湖城东支行,安徽省芜湖市鸠江区万春大道东部星城西区1#楼02、03室,0553-3873717,118.422543,31.378436
交通银行芜湖碧桂园支行,安徽省芜湖市三山区碧桂园商业广场1号楼,0553-3839117,118.305610,31.258470
交通银行芜湖三山支行,芜湖市三山区新芜繁公路市场科技楼,0553-5801633,118.236145,31.225949
交通银行芜湖湾沚支行,芜湖市芜湖县湾沚镇荆江东路10号门面房,0553-8826653,118.576614,31.145014
交通银行芜湖无为支行,芜湖市无为县无为电力大厦内,0553-6126165,117.918186,31.301628
交通银行蚌埠兴业支行,安徽省蚌埠市体育路兴业街交汇处百合公馆2号楼商铺109号.110号.111号,0552-2065820,117.378215,32.937968
交通银行蚌埠龙子湖区支行,蚌埠市凤阳东路南侧解放三路西侧国祯广场6栋0013号,0552-3018631,117.388283,32.94531
交通银行蚌埠治淮路支行,安徽省蚌埠市龙子湖区解放一路146号,0552-3050371,117.381615,32.950304
交通银行蚌埠奋进支行,安徽省蚌埠市蚌山区工农路172号,0552-4042352,117.35938,32.93367
交通银行蚌埠分行营业部,安徽省蚌埠市南山路88号,0552-2062960,117.36802,32.94321
交通银行蚌埠财院支行,蚌埠市迎湖路26号,0552-3111472,117.39779,32.92624
交通银行蚌埠宝龙支行,兴业街555号宝龙城市广场4号楼,0552-2053452,117.378252,32.930949
交通银行蚌埠光彩支行,蚌埠市光彩大市场客运南站南门西侧,0552-4921247,117.357996,32.916611
交通银行蚌埠南苑支行,安徽省蚌埠市蚌山区南湖路与兰陵路交叉口,0552-3112517,117.39263,32.92034
交通银行蚌埠航苑路支行,安徽省蚌埠市经济开发区航苑路与广场舞街交叉口阿尔卡迪亚蓝天城1号楼西侧1层02号,0552-3726352,117.370497,32.933248
交通银行蚌埠国货路支行,安徽省蚌埠市蚌山区国货路51号,0552-2079523,117.36525,32.94521
交通银行蚌埠前进支行,蚌埠市朝阳路222号,0552-4021447,117.35395,32.93751
交通银行蚌埠禹会支行,蚌埠市百大拓基广场南区商铺01019号,0552-4082998,117.32601,32.92860
交通银行蚌埠锦江支行,蚌埠市东海大道5118号（君临天下会所商铺-1-09）,0552-4085676,117.339499,32.916575
交通银行蚌埠燕山路支行,安徽省蚌埠市禹会区燕山路中段南侧1036号,0552-4127307,117.341132,32.910899
交通银行蚌埠高新支行,安徽省蚌埠市高新区燕山路1799号（商业2栋1单元1层101室）,0552-4075556,117.319203,32.915971
交通银行蚌埠中恒国际商贸城支行,安徽省蚌埠市淮上大道3333号义乌国际商贸城一层南4号,0552-3823739,117.392046,32.975039
交通银行蚌埠怀远支行,安徽省蚌埠市怀远县城关镇禹王路东段(国土资源局1楼),0552-8828026,117.2033218,32.9568156
交通银行蚌埠淮上区支行,蚌埠市解放北路现代农资机电大市场E1-222,0552-3112673,117.390504,32.974846
交通银行淮南大通支行,大通区民主北路（转盘街）,0554-2512470,117.05230,32.63145
交通银行淮南朝阳支行,朝阳西路金地俊园101号,0554-6885317,117.00315,32.638575
交通银行淮南龙泉支行,泉山路83号（近洞山中路）,0554-6416600,116.974209,32.621195
交通银行淮南四海支行,田家庵区人民北路57号（香港街交口）,0554-3646855,117.018954,32.650884
交通银行淮南分行营业部,朝阳中路95号（学院南路交口）,0554-6642811,117.012001,32.639339
交通银行淮南田家庵支行,人民南路21号（朝阳中路交口）,0554-2674050,117.022312,32.640712
交通银行淮南国庆路支行,淮舜南路523号（国庆路交口）,0554-2683247,117.029602,32.649385
交通银行淮南公园支行,龙湖北路9号（淮师附小对面）,0554-3641607,117.01596,32.64826
交通银行淮南龙湖支行,田家庵区龙湖南路海沃世贸商城一楼,0554-2692737,117.01861,32.633168
交通银行淮南洞山支行,淮南市洞山中路10号（矿务局对面）,0554-6643290,117.004282,32.6265
交通银行淮南泉山支行,淮南市舜耕西路淮化新村新2号楼1-3门面,0554-6416996,116.976108,32.628289
交通银行淮南兴旺支行,安徽省淮南市田家庵区洞山街道山水居小区49栋103室,0554-6886490,117.013664,32.624259
交通银行淮南淮滨路支行,安徽省淮南市田家庵区淮滨路96号,0554-3624047,117.02234,32.66031
交通银行淮南人民路支行,安徽省淮南市田家庵区人民南路318号财富中心百大商厦一楼,0554-2687694,117.02009,32.64565
交通银行淮南开发区支行,淮南市朝阳东路城岸罗马广场3号（领城小区对面）,0554-2694251,117.038373,32.643535
交通银行淮南谢家集支行,谢家集区卧龙山路与唐山路交叉口,0554-5686821,116.865397,32.596722
交通银行淮南平山路支行,淮南市谢家集平山路,0554-5716691,116.859995,32.601042
交通银行淮南八公山支行,蔡新路建南村商铺（近淮凤路）,0554-5618757,116.842797,32.626671
交通银行马鞍山分行营业部,马鞍山市花山区湖东南路156号,0555-2389170,118.50899,31.676877
交通银行马鞍山雨山路支行,雨山路1293号与1297号,0555-2485169,118.518870,31.672800
交通银行马鞍山湖南路支行,马鞍山市雨山区湖南路25号,0555-2620570,118.494431,31.684254
交通银行马鞍山当涂支行,当涂县姑孰镇太白中路473-477号,0555-6755628,118.490274,31.569486
交通银行淮北相山支行,安徽省淮北市相山区南黎路149号水岸碧桂园小区1栋105-108号,0561-3159062,116.80,33.94
交通银行淮北古城路支行,安徽省淮北市相山区古城路206号GS-1栋14-19号,0561-3159052,116.7970485342,33.9709464095
交通银行淮北分行营业部,淮北市相山区人民路177号,0561-3159006,116.789035,33.953755
交通银行淮北淮海华府支行,淮北市相山区相山北路8号,0561-3159087,116.798642,33.978323
交通银行铜陵恒大绿洲支行,安徽省铜陵市铜官山区翠湖四路东段127号、131号网点,0562-2809857,117.8403,30.96197
交通银行铜陵丰收门支行,安徽省铜陵市金山中路1638号,0562-2186652,117.802773,30.920816
交通银行铜陵分行营业部,安徽省铜陵市长江中路990号,0562-2186621,117.81823,30.924928
交通银行铜陵北京路支行,安徽省铜陵市石城大道中段1818号,0562-2896270,117.824494,30.935146
交通银行铜陵凤凰城支行,安徽省铜陵市凤凰城B区翠湖一路153号网点,0562-2896280,117.812648,30.953325
交通银行安庆分行营业部,龙山路99号,0556-5509603,117.039108,30.506547
交通银行安庆皖江大道支行,安庆市迎江区皖江大道迎江世纪城启航社1栋1层11室,0556-5536501,117.10104,30.519654
交通银行安庆华中路支行,华中西路331号,0556-5529484,117.058967,30.506653
交通银行安庆康熙河支行,安徽省安庆市迎江区人民路290号,0556-5564286,117.056279,30.504536
交通银行安庆宜城路支行,安徽省安庆市迎江区宜城路97号,0556-0556-5510959,117.051467,30.509334
交通银行安庆集贤支行,集贤南路130号,0556-5527744,117.04347,30.52046
交通银行安庆石化天桥支行,水上公园路60号,0556-5315043,117.04476,30.52885
交通银行安庆德宽支行,德宽路251号,0556-0556-0556-5550464,117.031796,30.510124
交通银行安庆纺南支行,安徽省安庆市大观区纺织南路39号,0556-5520888,117.046666,30.51628
交通银行安庆光彩支行,天柱山路光彩二期4区5栋,0556-5363535,117.07123,30.540119
交通银行安庆中兴大道支行,中兴大道101号,0556-0556-5322642,117.05246,30.534727
交通银行安庆开发区支行,菱湖北路30号,0556-5337438,117.06195,30.53229
交通银行安庆怀宁支行,怀宁县高河镇黄梅路80号,0556-0556-4685555,116.839437,30.73501
交通银行安庆桐城支行,滨河广场1号楼,0556-6962988,116.954226,31.051132
交通银行黄山新商业步行街支行,安徽省黄山市屯溪区新黄山商业步行街A区5幢2号,0559-2180115,118.31976,29.7088
交通银行黄山屯溪支行,安徽省黄山市屯溪区昱新路2号黎阳映像39幢8-9号,0559-0559-2180115,118.29712,29.70674
